doi,volume,issue,start page,end page,title,authors
10.1155/1912/45893,19,3,97,97,A New Species of Emesidæ From Vermont,Nathan Banks
10.1155/1912/92180,19,3,97,97,Melanetærius Infernalis Fall,H. Bickhardt
10.1155/1913/25924,20,5,170,170,Merope Tuber in Massachusetts,C. W. Johnson
10.1155/1913/29495,20,5,170,170,A Question of Authorship,Frederick Knab
10.1155/1913/46076,20,6,205,205,Book Review,Charles T. Brues
10.1155/1913/72309,20,5,170,170,Mantispa Interrupta Say in New England,C. W. Johnson
10.1155/1913/87691,20,6,205,205,Note on Two Preoccupied Muscied Names,A. L. Melander
10.1155/1921/52645,28,1,7,7,A New Ptinid for New England,C. W. Johnson
10.1155/1921/98931,28,1,7,7,Sympetrum Corruptum in Massachusetts,A. P. Morse
10.1155/1925/48089,32,2,113,113,Note on Panurgidæ (Bees),Charles Robertson
10.1155/1925/94375,32,2,113,113,Another Instance of the Orthward Migration of Odonata in the Spring,R. Heber Howe
10.1155/1927/48041,34,2,134,134,Another Vagrant Grasshopper,Albert P. Morse
10.1155/1927/94318,34,2,134,134,The Bowditch Collection of Chrysomelidæ,N. Banks
10.1155/1929/48919,36,1,59,59,The Unexpected Acid Test,C. A. Frost
10.1155/1874/45213,1,1,2,3,English Names for Butterflies,S. H. Scudder
10.1155/1874/91598,1,1,3,4,Bibliographical Record,B. Pickman Mann
10.1155/1874/48784,1,1,4,4,Interesting Capture,H. K. Morrison
10.1155/1875/46468,1,10,41,43,Notes on White Mountain Noctuidae,H. K. Morrison
10.1155/1875/92845,1,10,43,44,English Names for Butterflies,S H. Scudder
10.1155/1875/96417,1,10,44,48,Biblographical Record,B. Pickman Mann
10.1155/1875/53803,1,11,49,52,Description of the Larva of Galerita Janus,H. G. Hubbard
10.1155/1875/12089,1,11,52,56,Bibliographical Record,B. Pickman Mann
10.1155/1875/58374,1,11,56,56,English Name of Butterflies,S. H. Scudder
10.1155/1875/15751,1,12,57,59,A North Greenland Butterfly,Samuel H. Scudder
10.1155/1875/62048,1,12,59,64,Bibliographical Record,B. Pickman Mann
10.1155/1875/19325,1,12,64,64,Proceedings of the Club,B. Pickman Mann
10.1155/1875/65710,1,13,65,68,On the Relation Between Europpean and American Noctuina,
10.1155/1875/23986,1,13,68,70,Varieties of Cleora Pulchraria Minot,H. K. Morrison
10.1155/1875/70383,1,13,70,72,Bibliographical Record,B. Pickman Mann
10.1155/1875/27569,1,14,73,76,On the Localities and Habits of the Various Species of Omus,Henry Edwards
10.1155/1875/82191,1,14,76,77,On the Insect Founa of the White Mountains,A. R. Grote
10.1155/1875/39478,1,14,78,80,Biblographical Record,B. Pickman Mann
10.1155/1875/85854,1,15,81,84,The Introduction of Danaida Plexippus into the Pacific Islands,Samuel H. Scudder
10.1155/1875/43150,1,15,85,85,On the Insect Fauna of the White Mountains,H. K. Morrison
10.1155/1875/90527,1,15,86,88,Bibliographical Record,B. Pickman Mann
10.1155/1875/47813,1,16,89,93,Notes on Luminous Larvae of Elateridae,B. Pickman Mann
10.1155/1875/94098,1,16,93,94,The Note of the Katydid,Samuel H. Scudder
10.1155/1875/51484,1,16,94,96,Bibliographical Record,B. Pickman Mann
10.1155/1875/97671,1,16,96,96,Proceedings of the Club,
10.1155/1875/56057,1,17,97,99,Bleaching the Wings of Lepidoptera,Geo Dimmock
10.1155/1875/13434,1,17,99,100,On the Insect Fauna of the White Mountains,A. R. Grote
10.1155/1875/59620,1,17,100,104,Bibliographical Record,B. Pickman Mann
10.1155/1875/17017,1,18,105,106,The Chirp of the Mole-Cricket,Samuel H. Scudder
10.1155/1875/63293,1,18,106,107,Hibernation of Amphipyra pramidoides,Roland Thaxter
10.1155/1875/20679,1,18,107,112,Bibliographical Record,B. Pickman Mann
10.1155/1875/67956,1,19,113,115,On a Supposed Case of Seasonal Dimorphism Among Diptera,C. R. Osten Sacken
10.1155/1875/25252,1,19,115,120,Bibliographical Record,B. Pickman Mann
10.1155/1875/71628,1,19,120,120,Proceedings of the Club,
10.1155/1874/38232,1,2,5,6,Notes on the Habits of Magdalinus armicollis Say,H. G. Hubbard
10.1155/1874/95171,1,2,7,7,Collecting in the White Mountains,Samuel H. Scudder
10.1155/1874/83658,1,2,7,8,Bibliographical Record,B. Pickman Mann
10.1155/1875/28915,1,20,121,125,On an Immense Flight of Small Butterflies (Terias Lisa) in the Bermudas,J. Matthew Jones
10.1155/1875/75202,1,20,125,128,Bibliographical Record,B. Pickman Mann
10.1155/1876/32587,1,21,129,131,Spiders Common to New England and Europe,J. H. Emerton
10.1155/1876/79764,1,21,131,131,Arctic Lepidoptera in the White Mountains,A. R. Grote
10.1155/1909/71301,16,2,31,31,Chrysophanid Notes,K. R. Coolidge
10.1155/1909/74863,16,2,34,35,Notes on Tachinid Parasites of Chrysomelidae,Frederick Knab
10.1155/1909/79437,16,3,43,48,Notes on Our Species of Emesidae,Nathan Banks
10.1155/1909/83120,16,3,58,64,"Incidental Captures of Lepidoptera at Plano, Texas",E. S. Tucker
10.1155/1909/86782,16,3,67,68,Coleoptera Taken at Framingham,C. A. Frost
10.1155/1909/90198,16,1,1,4,North American Henicocephalidae,O. A. Johannsen
10.1155/1909/91454,16,5,106,110,"Oligosita AmeriganaAshmead Species Nova, a New Chalcidoid of the Fabily Trichogrammidae From Illinois",A. A. Girault
10.1155/1909/93761,16,1,12,12,Melanoplus Harrisii N. Sp.,A. P. Morse
10.1155/1909/95028,16,5,112,112,The Arachnida of the Galapagos Islands,Karl R. Coolidge
10.1155/1909/97343,16,1,13,16,"The Food Plant of Enarmonia Tristrigana, Clemens",C. A. Frost
10.1155/1909/98590,16,5,114,114,Convocation Week Meetings in Boston,
10.1155/1910/23843,17,3,122,124,Reviews,
10.1155/1910/26170,17,1,37,37,Recent Literature,Charles T. Brues
10.1155/1910/41741,17,2,78,78,Book Reviews,Charles T. Brues
10.1155/1910/46314,17,2,81,82,Book Reviews,Charles T. Brues
10.1155/1910/64212,17,1,28,28,The Harris Memorial Tablet,W. L. W. Field
10.1155/1909/71301,16,2,31,31,Chrysophanid Notes,K. R. Coolidge
10.1155/1909/74863,16,2,34,35,Notes on Tachinid Parasites of Chrysomelidae,Frederick Knab
10.1155/1909/79437,16,3,43,48,Notes on Our Species of Emesidae,Nathan Banks
10.1155/1909/83120,16,3,58,64,"Incidental Captures of Lepidoptera at Plano, Texas",E. S. Tucker
10.1155/1909/86782,16,3,67,68,Coleoptera Taken at Framingham,C. A. Frost
10.1155/1909/90198,16,1,1,4,North American Henicocephalidae,O. A. Johannsen
10.1155/1909/91454,16,5,106,110,"Oligosita amerigana Ashmead Species Nova, a New Chalcidoid of the Fabily Trichogrammidae From Illinois",A. A. Girault
10.1155/1909/93761,16,1,12,12,Melanoplus harrisii N. Sp.,A. P. Morse
10.1155/1909/95028,16,5,112,112,The Arachnida of the Galapagos Islands,Karl R. Coolidge
10.1155/1909/97343,16,1,13,16,"The Food Plant of Enarmonia Tristrigana, Clemens",C. A. Frost
10.1155/1909/98590,16,5,114,114,Convocation Week Meetings in Boston,
10.1155/1910/23843,17,3,122,124,Reviews,
10.1155/1910/26170,17,1,37,37,Recent Literature,Charles T. Brues
10.1155/1910/41741,17,2,78,78,Book Reviews,Charles T. Brues
10.1155/1910/46314,17,2,81,82,Book Reviews,C. T. Brues
10.1155/1910/64212,17,1,28,28,The Harris Memorial Tablet,W. L. W. Field
10.1155/1910/65467,17,3,118,121,Proceedings of the Cambridge Entomological Club,
10.1155/1910/72546,17,1,38,40,Fifth Meeting of the Entomological Society of America,
10.1155/1910/79027,17,6,258,258,Reviews,Frederick Blanchard
10.1155/1910/93946,17,4,169,176,Reviews,
10.1155/1912/17405,19,1,22,22,Second International Congress of Entomology,
10.1155/1912/23424,19,3,111,111,Errata,
10.1155/1912/62720,19,6,183,183,Book Notice,C. W. J.
10.1155/1912/63791,19,1,22,23,The Washington Meeting of the Entomological Society of America,
10.1155/1912/65047,19,3,110,111,Book Notices,
10.1155/1912/82863,19,6,208,208,Correction,
10.1155/1914/43180,21,2,76,79,The Phorid Genus Platyphora in America,Charles T. Brues
10.1155/1914/78548,21,6,199,199,Correction,
10.1155/1914/85894,21,2,75,76,Note on the Habits of Liomyrmex,William Morton Wheeler
10.1155/1914/94139,21,2,83,83,Book Notice,W. L. W. Field
10.1155/1915/28068,22,6,220,220,Errata and Corrigenda,
10.1155/1915/87325,22,2,64,64,Book Reviews,
10.1155/1916/17861,23,1,25,25,Dr. Frederick William Russell,
10.1155/1916/19127,23,4,128,129,Book Review,H. M. Parshley
10.1155/1916/96209,23,3,94,94,Cora H. Clarke,
10.1155/1917/21718,24,3,91,98,New Miscellaneous Chalcid-Flies From North America,A. A. Girault
10.1155/1918/69793,25,2,36,36,Book Reviews,Charles T. Brues
10.1155/1920/50694,27,5,127,128,Proceedings of the Cambridge Entomological Club,
10.1155/1920/53021,27,1,20,20,Entomological Notes From: The Museum of Comparative Zoology,
10.1155/1920/69494,27,2-3,66,66,Proceedings of the Cambridge Entomological Club,
10.1155/1920/85074,27,4,87,88,Proceedings of the Cambridge Entomological Club,
10.1155/1920/95726,27,1,19,20,Proceedings of the Cambridge Entomological Club,
10.1155/1920/96971,27,5,129,129,Book Reviews,Albert P. Morse
10.1155/1921/41982,28,2,61,61,Proceedings of the Cambridge Entomological Club,
10.1155/1921/69135,28,1,29,29,Proceedings of the Cambridge Entomological Club,
10.1155/1921/82389,28,5-6,168,169,Proceedings of the Cambridge Entomological Club,
10.1155/1921/96514,28,3,92,93,Proceedings of the Cambridge Entomological Club,
10.1155/1922/17982,29,3,123,125,Proceedings of the Cambridge Entomological Club,
10.1155/1923/27482,30,1,36,39,Proceedings of the Cambridge Entomological Club,
10.1155/1923/35818,30,2,51,51,The Zoological Record,
10.1155/1923/48972,30,6,227,228,Proceedings of the Cambridge Entomological Club,
10.1155/1923/51398,30,2,93,94,Proceedings of the Cambridge Entomological Club,
10.1155/1923/63207,30,3-4,133,134,Book Review,
10.1155/1923/65625,30,1,30,30,Verbenapis - A Correction,
10.1155/1923/70296,30,1,35,36,Recent Books,
10.1155/1924/39749,31,3-4,170,173,Proceedings of the Cambridge Entomological Club,
10.1155/1924/63674,31,5,245,246,Proceedings of the Cambridge Entomological Club,
10.1155/1924/83819,31,6,312,313,Proceedings of the Cambridge Entomological Club,
10.1155/1925/18476,32,6,319,320,Proceedings of the Cambridge Entomomlogical Club,
10.1155/1925/62598,32,2,118,118,The New York State List of Insects,
10.1155/1925/93405,32,2,117,117,International Entomological Congress,
10.1155/1926/26594,33,6,171,171,Professor Carlo Emery,
10.1155/1926/72971,33,6,172,172,Benjamin Pickman Mann,
10.1155/1927/45715,34,6,247,247,Book Notices,
10.1155/1927/74174,34,1,58,58,Book Notice,H. B. Weiss
10.1155/1928/25103,35,4,237,238,Book Notices,C. T. Brues
10.1155/1928/29737,35,1,65,65,Proceedings of The Cambridge Entomological Club,F. M. Carpenter
10.1155/1929/25287,36,4,388,388,Errata for vol. 36,
10.1155/1929/91634,36,1,59,59,Proceedings of the Cambridge Entomoligal Club,
10.1155/1930/47207,37,2,192,192,Proceedings of the Cambridge Entomological Club,
10.1155/1931/34052,38,4,194,195,500th Meeting of the Cambridge Entomological Club,
10.1155/1931/48278,38,1,71,71,Proceedings of the Cambridge Entomological Club,Richard Dow
10.1155/1931/60286,38,2-3,127,128,Book Notice,F. M. Carpenter
10.1155/1932/35481,39,1-2,52,52,Book Notice,F. M. Carpenter
10.1155/1934/45430,41,1,49,49,Obituary,T. H. Jones
10.1155/1934/69257,41,3,184,184,"Review: Studies in North American Trichoptera, 1",
10.1155/1936/61295,43,1,27,28,Book Review: Our Enemy the Termite,W. M. Wheeler;Thomas Elliot Snyder
10.1155/1937/58768,44,1-2,60,60,Obituary,
10.1155/1939/21365,46,4,174,174,Erratum,
10.1155/1939/82868,46,2-3,43,51,Notes on Tutterflies From Hispaniola,Marston Bates
10.1155/1942/68541,49,1-2,40,40,Correction,
10.1155/1944/91483,51,1-2,7,7,Obituary,
10.1155/1946/71254,53,1-2,31,31,Special Christmas Meeting of the Cambridge Entomological Club,
10.1155/1947/47510,54,3,208,208,Eighth International Congress of Entomology,O. A. Johannsen
10.1155/1947/73743,54,2,143,144,Book Notice,J. Bequaert
10.1155/1948/32385,55,1,35,35,Theodore Dru Addison Cockerell,
10.1155/1949/82949,56,4,174,174,Seventy-Fifth Anniversary of the Cambridge Entomological Club,F. M. Carpenter
10.1155/1950/37635,57,1,31,32,Book Review: Ants of North America,
10.1155/1906/52129,13,6,135,135,Melanoplus Viridipesin New England,A. P. Morse
10.1155/1906/56791,13,6,137,148,"Trichogramma Pretiosa Riley. Oviposition,—a Résumé",Alec. Arsène Girault
10.1155/1906/60463,13,6,149,152,The Entomological Society of America,
10.1155/1906/64037,13,6,154,157,Some Common Errors in the Nomenclature of the Dipterous Wing,S. W. Williston
10.1155/1906/68598,13,6,158,158,Nemobius palustris Blatchley,A. P. Morse
10.1155/1906/72371,13,6,159,159,Errata,
10.1155/1906/74689,13,1,5,10,North American Bees of the Genera Andrena and Melitta in the British Museum.—I,T. D. A. Cockerell
10.1155/1906/79262,13,1,22,22,Life Histories of North American Geometridae—LXIV,Harrison G. Dyar
10.1155/1906/82926,13,5,109,113,"Notes on the Bees of Southern Maine: Anthophoridae, Halictoididae, Macropidae and Panurgidae",J. H. Lovell;T. D. A. Cockerell
10.1155/1906/86497,13,5,114,116,New Dascyllidae,Charles Schaeffer
10.1155/1906/91271,13,5,119,122,New Acridiidae From the Southern States,Albert P. Morse
10.1155/1906/94834,13,6,135,135,To All Interested in Entomology,
10.1155/1906/98406,13,6,136,136,The Pattern Variation in the Pupa of Melitaea Chalcedon—Plate VIII,Lilian Ramsay
10.1155/1907/12128,14,5,101,110,The Sphecodidae of Southern Maine,J. H. Lovell;T. D. A. Cockerell
10.1155/1907/14536,14,3,45,57,"Biological Notes on the Colorado Potato Beetle,Leptinotarsa Decemlineata(Say), With Technical Description of its Stages",A. A. Girault;A. H. Rosenfeld
10.1155/1907/18108,14,3,58,58,On Some Unrecorded Generic and Specific Names,A. N. Caudell
10.1155/1907/21781,14,3,61,61,Special meeting of the Entomological Society of America,
10.1155/1907/26353,14,3,62,62,Vanessa Milberti in Boston,John Lowell
10.1155/1907/32434,14,1,1,4,The Swarming of Anopheles Punctipennis Say,Frederick Knab
10.1155/1907/34689,14,4,68,70,Two New Myrmecophilous Histeridae,H. C. Fall
10.1155/1907/37017,14,1,8,8,Large Butterfly Captured by Crab-Spider,Wm. T. Davis
10.1155/1907/38262,14,4,71,74,Three Galls Made by Cyclorrhaphous Flies,Millett T. Thompson
10.1155/1907/40679,14,1,10,10,Entomological Society of America,
10.1155/1907/41925,14,4,80,86,Trichogramma Pretiosa Riley: Seasonal History,A. A. Girault
10.1155/1907/45252,14,1,14,14,Paratylotropidia Beutenmuelleri Sp. Nov.,Albert P. Morse
10.1155/1907/46496,14,5,89,91,"Explanation of Plate II, with Description of New Variety ofLimenitis Ursula",H. H. Newcomb
10.1155/1907/48915,14,1,21,21,Proceedings of the Club,Chas. W. Johnson
10.1155/1907/52586,14,2,27,39,Hosts of Insect Egg-Parasites in North and South America,A. Arsène Girault
10.1155/1907/53831,14,5,95,100,A Review of the Species of the Genus Bombylius of the Eastern United States,Charles W. Johnson
10.1155/1907/57159,14,2,41,43,"The Snow–Fly,Chionea Valga Harris",Charles W. Johnson
10.1155/1907/60823,14,3,57,57,Podisma Australis Nom. Nov.,A. P. Morse
10.1155/1907/64394,14,3,59,61,"List of Rarer Moths Taken in Sherborn, MASS.",E. J. Smith
10.1155/1907/69067,14,3,62,62,69 Moths Taxen in One Hour—41 Species,C. V. Blackburn
10.1155/1907/72729,14,3,63,65,Proceedings of the Club,
10.1155/1907/76303,14,4,67,67,The Home of A Famous Entomologist,W. L. W. F.
10.1155/1907/79621,14,1,5,8,Wright's Notes on Butterfly Biology,Vernon L. Kellogg
10.1155/1907/80965,14,4,70,70,The Entomological Society of America,
10.1155/1907/83293,14,1,9,10,"A New Genus and Species of the Family Tachinidae, Parasitic onArchips Cerasivorana",Charles W. Johnson
10.1155/1907/84639,14,4,75,80,Some North American Syrphidae,Charles W. Johnson
10.1155/1907/86957,14,1,11,13,Validity of the Culicid Subfamily Deinoceritinae,Eleven Groesbeeck Mitchell
10.1155/1907/89212,14,4,87,88,Four Useful Books,W. L. W. Field
10.1155/1907/91629,14,1,15,21,The Megachilidae of Southern Maine,J. H. Lovell;T. D. A. Cockerell
10.1155/1907/92873,14,5,91,91,The Newark Entomological Society's Loss,John A. Gorssbeck
10.1155/1907/95202,14,2,23,26,The North American Species of Glaresis,H. C. Fall
10.1155/1907/96456,14,5,92,94,Life Histories of North American Geometridae.—LXVIII,Harrison G. Dyar
10.1155/1907/98763,14,2,40,40,A Female Spider With One Male Palpus,J. H. Emerton
10.1155/1908/10750,15,2,41,42,Notes on the Bee-Genus Exaerete,T. D. A. Cockerell
10.1155/1908/18986,15,2,44,44,Cambridge Entomological Club,
10.1155/1908/23659,15,3,50,52,Notes on the Inheritance of Variations in the Color Pattern of Crioceris Asparagi,Frank E. Lutz
10.1155/1908/27241,15,3,58,59,"A Note on Calotarsa, and Descriptions of Two New Species of Callimyia",Charles W. Johnson
10.1155/1908/34231,15,1,3,3,Recent Entomological Literature,C. W. Johnson
10.1155/1908/35476,15,4,67,68,The Aphid Genus Forda,S. A. Rohwer
10.1155/1908/37893,15,1,6,9,Outline Life-History of the Chrysomelid Gastroidea cyanea Melsheimer,A. A. Girault
10.1155/1908/39150,15,4,81,85,Western Lepidoptera—I,Karl R. Coolidge
10.1155/1908/41567,15,1,11,13,The Mallophaga of the World: Systematic Summary,Vernon L. Kellogg
10.1155/1908/42813,15,2,25,25,"Tettigidean Notes, and a New Species",A. P. Morse
10.1155/1908/46139,15,1,16,20,The Entomological Society of America,J. C. Bradley
10.1155/1908/49702,15,2,25,25,A Note on the Distribution of Bittacomorpha jonesi,C. W. Johnson
10.1155/1908/53473,15,2,32,40,The Halictidae of Southern Maine,John H. Lovell
10.1155/1908/58047,15,2,42,42,Proceedings of the Club,
10.1155/1908/61710,15,2,43,43,To Books of Evolution,W. L. W. Field
10.1155/1908/65282,15,3,47,49,A New Species of Tipula With Vestigial Wings,R. W. Doane
10.1155/1908/69846,15,3,53,57,"Encarcia versicolor Species Novum, an Eulophid Parasite of the Greenhouse Whitefly,Aleyrodes VaporariorumWestwood",A. Arsène Girault
10.1155/1908/73618,15,3,60,60,The Screw Worm (Chrysomyia macellaria),Charles W. Johnson
10.1155/1908/75935,15,1,1,3,The Workers of Vespa carolina Dr. Resemble in Coloration the Males. A Correction,C. H. Turner
10.1155/1908/78191,15,4,61,67,"Some Trichoptera, and Allied Insects, From Newfoundland",Nathan Banks
10.1155/1908/80608,15,1,4,5,Two New Mutillidae From Colorado,T. D. A. Cockerell;S. A. Rohwer
10.1155/1908/81853,15,4,69,80,"The Diptera of the Bahamas, With Notes and Description of One New Species",Charles W. Johnson
10.1155/1908/84181,15,1,9,11,Notes on Harris's Types of Cynipidae,William Beutenmüller
10.1155/1908/85427,15,4,85,87,Notes on the Feeding Habits of Cimex lectularius Linnaeus,A. Arsène Girault
10.1155/1908/87843,15,1,14,15,"Notes on New England Bombyliidae, With a Description of a New Species of Anthrax",Charles W. Johnson
10.1155/1908/92516,15,2,21,24,"Observations on the Breeding Habits of Three Chrysomelid Beetles,Calligrapha bigsbyana, C. muli-punctata and C. lunata",Robert W. Hegner
10.1155/1908/96087,15,2,26,32,Notes on Attelabus rhois and Parasite,C. A. Frost
10.1155/1909/16579,16,1,19,19,Proceedings of the Club,C. A. Frost
10.1155/1909/20351,16,2,23,28,"The Fossil Ceropalidae of Florissant, Colorado",S. A. Rohwer
10.1155/1909/24915,16,2,29,30,"A New Chalcidoid of the Eulophid Genus Aphelinus Dalman, Parasitic on Schizoneura crataegi Oestlund",A. Arsène Girault
10.1155/1909/28486,16,2,32,33,Notes on the Synonymy of the Species of Erax of the Eastern United States,Charles W. Johnson
10.1155/1909/32160,16,2,35,42,"A List of Coleoptera Collected Within Ten Miles of Fall River, Massachusetts",Norman S. Easton
10.1155/1909/36823,16,3,49,57,"A List of Coleoptera Collected Within Ten Miles of Fall River, Massachusetts",Norman S. Easton
10.1155/1909/40495,16,3,65,67,"Note on the Bag Worm, Thyridopterix",Arthur Harris
10.1155/1909/45068,16,5,99,105,Some Experiments on Flacherie in the Gypsy Moth,Willliam Reiff
10.1155/1909/47384,16,1,5,12,The Importance of Local Ecological Studies to Entomology,Charles W. Johnson
10.1155/1909/48631,16,5,110,111,Notes on the Early Stages of Deilephila Intermedia,Allyn Cox
10.1155/1909/52404,16,5,113,114,Notes on the Distribution of Some Trypetidae With Description of a New Species,Charles W. Johnson
10.1155/1909/54719,16,1,16,16,Canker Worm Moths With Crippled Wings,William Reiff
10.1155/1909/59292,16,1,17,18,More Tipula With Vestigial Wings,R. W. Doane
10.1155/1909/62956,16,1,20,22,Constitution of the Cambridge Entomological Club,
10.1155/1909/67528,16,2,28,28,Zeuzera Pyrina in Boston,William Reiff
10.1155/1955/24360,62,3,97,97,Obituary Notice,Editorial Board of Psyche
10.1155/1955/46921,62,1,41,41,The Southwestern Research Station of the American Museum of Natural History,
10.1155/1965/67498,72,1,1,1,William Morton Wheeler Memorial Issue,F. M. Carpenter
10.1155/1973/98796,80,4,374,374,The Hundredth Anniversary of the Cambridge Entomological Club,
10.1155/1974/34019,81,2,257,257,Centennial of Entomology at Cornell University,
10.1155/1974/36326,81,1,1,2,Centennial issue,Frank M. Carpenter
10.1155/1975/48654,82,3-4,314,314,The International Union for the Study of Social Insects,
10.1155/1977/17673,84,1,107,107,Reprints of Articles,W. M. Wheeler
10.1155/1979/46401,86,2-3,167,212,Nearctic Species of the Wolf Spider Genus Trochosa (Araneae: Lycosidae),Allen R. Brady
10.1155/1980/32646,3,69,7,7,Introductory—Announcement,George Dimmock
10.1155/1980/34765,87,1-2,141,141,Erratum,
10.1155/1980/79832,3,69,8,10,Bibliographical Record,
10.1155/1903/91657,10,324,168,169,Life Histories of North American Geometridae.—XLII,Harrison G. Dyar
10.1155/1903/93973,10,321,43,46,Reviews,Wm. H. Ashmead
10.1155/1903/95240,10,325-326,184,185,Descriptions of Three New Diptera of the Genus Phthiria,Charles W. Johnson
10.1155/1903/97546,10,322,59,72,"Classification of the Gall-Wasps and the Parasitic Cynipoids, or the Superfamily Cynipoidea. II",William H. Ashmead
10.1155/1903/98902,10,325-326,187,187,Two Coccida From Samoa,Vernon L. Kellogg
10.1155/1904/10423,11,5,103,104,On the North American Species of Siphonella,C. F. Adams
10.1155/1904/13739,11,2,44,46,Proceedings of the Club,W. L. W. Field
10.1155/1904/14984,11,5,105,105,Life Histories of North American Geometridae.—LVI,Harrison G. Dyar
10.1155/1904/17312,11,3,54,60,New Species of Noctuids for 1904. No. 2,John B. Smith
10.1155/1904/18568,11,5,107,107,Proceedings of the Club,W. L. W. Field
10.1155/1904/19629,11,1,7,13,New Acridiidae From the Southeastern States,Albert P. Morse
10.1155/1904/20974,11,3,62,63,Wintering Larvae,F. H. Foster
10.1155/1904/23240,11,6,113,113,Abnormal Lepidoptera,
10.1155/1904/24303,11,1,15,20,"Some Notes, and Descriptions of Four New Diptera",Chas. W. Johnson
10.1155/1904/25647,11,3,65,68,Recent Entomological Literature,
10.1155/1904/26904,11,6,118,120,Hemileuca budleyi,Caroline Gray Soule
10.1155/1904/27964,11,1,21,22,On the Relations of Certain Myrmecophiles to Their Host Ants,Charles T. Brues
10.1155/1904/29219,11,4,72,72,One of the Smallest Digger Wasps,Henry L. Viereck
10.1155/1904/29548,11,2,38,38,Pelecinus Polyturator Drury,C. W. Johnson
10.1155/1904/30575,11,6,121,121,Life Histories of North American Geometridae.—LVII,Harrison G. Dyar
10.1155/1904/32892,11,4,74,74,The Calls of Spiders,Fred H. Lahee
10.1155/1904/35148,11,6,122,126,Recent Entomological Literature,
10.1155/1904/36210,11,2,28,28,The Orders of Insects,A. E. Shipley
10.1155/1904/37465,11,4,76,80,A Revised List of the Diptera of Bermuda,Charles W. Johnson
10.1155/1904/39782,11,2,30,32,"Spring Moths, and How to Catch Them",E. J. Smith
10.1155/1904/431637,11,1,23,24,Book Review,A. P. Morse
10.1155/1904/43546,11,2,33,34,Additional Note on Nemotelus,A. L. Melander
10.1155/1904/45802,11,4,82,82,A Supposed Cynipid Gall From the Roots of Goldenrod (Solidago),A. Arsène Girault
10.1155/1904/48128,11,2,35,35,When to Collect Tabanidae,Charles W. Johnson
10.1155/1904/49373,11,4,84,88,Recent Entomological Literature,
10.1155/1904/51790,11,2,37,38,Some of the Diptera to be Collected During April and May,C. W. Johnson
10.1155/1904/53046,11,5,102,102,Eurema Lisa in New Hampshire,James A. Field
10.1155/1904/56362,11,2,39,44,Recent Entomological Literature,
10.1155/1904/57609,11,5,104,104,Chryptorhynchus lapathi in Minnesota,F. L. Washburn
10.1155/1904/60136,11,3,47,53,Earwigs (Anisolabia maritima Bon.),Charles Barrows Bennett
10.1155/1904/61381,11,5,106,106,Black Backgrounds for Butterflies,W. L. W. Field
10.1155/1904/62453,11,1,1,6,Problems in the Genus Basilarchia,W. L. W. Field
10.1155/1904/63697,11,3,63,63,Proceedings of the Club,W. L. W. Field
10.1155/1904/64945,11,5,108,112,Recent Entomological Literature,
10.1155/1904/67026,11,1,14,14,An Abnormal Specimen of Bembidium scudderi,Roland Hayward
10.1155/1904/68270,11,3,64,64,Life Histories of North American Geometridae.–LIV,Harrison G. Dyar
10.1155/1904/69517,11,6,114,117,"Notes on the Insects of Barbados, St. Vincent, the Grenadines, and Grenada",Austin H. Clark
10.1155/1904/70687,11,1,20,20,Identification of Specimens,
10.1155/1904/71934,11,4,69,71,The Oviposition and Carnivorous Habits of the Green Meadow Grasshopper (Orchelimum Glaberrimum Burmeister),Joseph L. Hancock
10.1155/1904/73189,11,6,120,120,Spider Calls,Wm. T. Davis
10.1155/1904/74260,11,1,23,23,New England Records for Eritettix carinatus Scudder and Conocephalus triops Linn,W. E. Britton
10.1155/1904/75607,11,4,72,73,A New Species of Roach of the Genus Kakerlac (Loboptera Auct.) From Southern Texas,James A. G. Rehn
10.1155/1904/76852,11,6,122,122,Proceedings of the Club,W. L. W. Field
10.1155/1904/78924,11,2,25,28,A Faunal and Floral Tabulation-Scheme,Albert P. Morse
10.1155/1904/80279,11,4,75,75,Life Histories of North American Geometridae.–LV,Harrison G. Dyar
10.1155/1904/81526,11,6,126,126,A Correction,C. F. Adams
10.1155/1904/82596,11,2,29,29,Life Histories of North American Geometridae.—LIII,Harrison G. Dyar
10.1155/1904/83842,11,4,80,80,Diestrammena unicolor in North America,A. P. Morse
10.1155/1904/86169,11,2,32,32,Change of Marking in the Males of a Spider (Pellenes cristatus),J. H. Emerton
10.1155/1904/87415,11,4,81,82,Tanypus dyari Coquillet: Pupa and Adult Exclusion,A. Arsène Girault
10.1155/1904/90832,11,2,34,34,A Dipterous Parasite of the Box Turtle,J. H. Emertron
10.1155/1904/92087,11,4,83,83,Proceedings of the Club,W. L. W. Field
10.1155/1904/94505,11,2,36,36,Effects of Defoliation by Caterpillars on Tree Growth,F. H. Foster
